{
  "format": "yahriacad-interchange",
  "version": "1.0",
  "meta": {
    "generator": "YahriaCad 1.0",
    "created_at": "2025-01-15T10:00:00Z",
    "source": "kicad"
  },
  "schematic": {
    "name": "sample",
    "components": [
      {
        "ref": "R1",
        "value": "10k",
        "footprint": "Resistor_SMD:R_0603_1608Metric",
        "pins": [
          { "number": "1", "name": "1", "x": 0, "y": 0 },
          { "number": "2", "name": "2", "x": 0, "y": 2.54 }
        ]
      },
      {
        "ref": "C1",
        "value": "100n",
        "footprint": "Capacitor_SMD:C_0603_1608Metric",
        "pins": [
          { "number": "1", "name": "1", "x": 0, "y": 0 },
          { "number": "2", "name": "2", "x": 0, "y": 2.54 }
        ]
      },
      {
        "ref": "U1",
        "value": "NE555",
        "footprint": "Package_SO:SOIC-8_3.9x4.9mm_P1.27mm",
        "pins": [
          { "number": "1", "name": "GND", "x": 0, "y": 0 },
          { "number": "2", "name": "TRIG", "x": 0, "y": 1.27 },
          { "number": "6", "name": "THR", "x": 0, "y": 6.35 },
          { "number": "8", "name": "VCC", "x": 0, "y": 8.89 }
        ]
      }
    ],
    "nets": [
      {
        "name": "VCC",
        "net_class": "power",
        "connections": [
          { "component_ref": "R1", "pin_number": "1" },
          { "component_ref": "C1", "pin_number": "1" },
          { "component_ref": "U1", "pin_number": "8" }
        ]
      },
      {
        "name": "GND",
        "net_class": "power",
        "connections": [
          { "component_ref": "R1", "pin_number": "2" },
          { "component_ref": "C1", "pin_number": "2" },
          { "component_ref": "U1", "pin_number": "1" }
        ]
      },
      {
        "name": "SIG",
        "net_class": "default",
        "connections": [
          { "component_ref": "U1", "pin_number": "2" },
          { "component_ref": "U1", "pin_number": "6" }
        ]
      }
    ]
  },
  "layout": {
    "board": {
      "width_mm": 50,
      "height_mm": 40,
      "layer_count": 2,
      "layer_names": ["F.Cu", "B.Cu"]
    },
    "footprints": {
      "Resistor_SMD:R_0603_1608Metric": {
        "name": "Resistor_SMD:R_0603_1608Metric",
        "value": "10k",
        "pads": [
          { "name": "1", "shape": "rect", "x": -0.75, "y": 0, "width": 0.6, "height": 0.6, "rotation": 0, "layer": 0, "net": "VCC" },
          { "name": "2", "shape": "rect", "x": 0.75, "y": 0, "width": 0.6, "height": 0.6, "rotation": 0, "layer": 0, "net": "GND" }
        ],
        "body_width_mm": 1.6,
        "body_height_mm": 0.8,
        "height_mm": 0.6
      },
      "Capacitor_SMD:C_0603_1608Metric": {
        "name": "Capacitor_SMD:C_0603_1608Metric",
        "value": "100n",
        "pads": [
          { "name": "1", "shape": "rect", "x": -0.75, "y": 0, "width": 0.6, "height": 0.6, "rotation": 0, "layer": 0, "net": "VCC" },
          { "name": "2", "shape": "rect", "x": 0.75, "y": 0, "width": 0.6, "height": 0.6, "rotation": 0, "layer": 0, "net": "GND" }
        ],
        "body_width_mm": 1.6,
        "body_height_mm": 0.8,
        "height_mm": 0.6
      },
      "Package_SO:SOIC-8_3.9x4.9mm_P1.27mm": {
        "name": "Package_SO:SOIC-8_3.9x4.9mm_P1.27mm",
        "value": "NE555",
        "pads": [
          { "name": "1", "shape": "rect", "x": -1.95, "y": -1.905, "width": 1.5, "height": 0.6, "rotation": 0, "layer": 0, "net": "GND" },
          { "name": "2", "shape": "rect", "x": -1.95, "y": -0.635, "width": 1.5, "height": 0.6, "rotation": 0, "layer": 0, "net": "SIG" },
          { "name": "3", "shape": "rect", "x": -1.95, "y": 0.635, "width": 1.5, "height": 0.6, "rotation": 0, "layer": 0, "net": "SIG" },
          { "name": "4", "shape": "rect", "x": -1.95, "y": 1.905, "width": 1.5, "height": 0.6, "rotation": 0, "layer": 0, "net": "GND" },
          { "name": "5", "shape": "rect", "x": 1.95, "y": 1.905, "width": 1.5, "height": 0.6, "rotation": 0, "layer": 0, "net": "VCC" },
          { "name": "6", "shape": "rect", "x": 1.95, "y": 0.635, "width": 1.5, "height": 0.6, "rotation": 0, "layer": 0, "net": "VCC" },
          { "name": "7", "shape": "rect", "x": 1.95, "y": -0.635, "width": 1.5, "height": 0.6, "rotation": 0, "layer": 0, "net": "GND" },
          { "name": "8", "shape": "rect", "x": 1.95, "y": -1.905, "width": 1.5, "height": 0.6, "rotation": 0, "layer": 0, "net": "VCC" }
        ],
        "body_width_mm": 3.9,
        "body_height_mm": 4.9,
        "height_mm": 1.6
      }
    },
    "components": [
      {
        "ref": "R1",
        "value": "10k",
        "footprint": "Resistor_SMD:R_0603_1608Metric",
        "x": 8,
        "y": 8,
        "rotation": 0,
        "fixed": false
      },
      {
        "ref": "C1",
        "value": "100n",
        "footprint": "Capacitor_SMD:C_0603_1608Metric",
        "x": 16,
        "y": 8,
        "rotation": 0,
        "fixed": false
      },
      {
        "ref": "U1",
        "value": "NE555",
        "footprint": "Package_SO:SOIC-8_3.9x4.9mm_P1.27mm",
        "x": 30,
        "y": 20,
        "rotation": 0,
        "fixed": false
      }
    ],
    "nets": [
      { "name": "VCC", "net_class": "power" },
      { "name": "GND", "net_class": "power" },
      { "name": "SIG", "net_class": "default" }
    ],
    "tracks": [
      {
        "net": "VCC",
        "layer": 0,
        "width": 0.25,
        "points": [
          { "x": 8.75, "y": 8 },
          { "x": 24, "y": 8 },
          { "x": 31.95, "y": 18.095 }
        ]
      },
      {
        "net": "SIG",
        "layer": 0,
        "width": 0.25,
        "points": [
          { "x": 28.05, "y": 19.365 },
          { "x": 31.95, "y": 19.365 }
        ]
      }
    ],
    "vias": [
      {
        "net": "VCC",
        "x": 24,
        "y": 12,
        "from_layer": 0,
        "to_layer": 1,
        "diameter": 0.6,
        "drill": 0.3
      }
    ]
  }
}
